{
  "$schema": "./weights.schema.json",
  "version": 1,
  "updated": "2026-08-19",
  "notes": [
    "各レイヤーは『シグナル(code)』を出力し、scoring がここに書かれた points を引いて加算する。",
    "シグナルは 0〜1 の intensity を持つことができ、加点は points * intensity になる(既定は 1)。",
    "レイヤーのスコア = clamp(シグナル加点の合計 / saturation, 0, 1)。saturation はそのレイヤーが満点になる点数。",
    "レイヤーは group に属する。group スコア = Σ(レイヤースコア * weight) / Σ(判定できたレイヤーの weight)。テレメトリが取れず判定不能なレイヤーは母数から外れるので、モバイルでポインタ軌跡が取れないだけでスコアが動くことはない。",
    "weight はグループ内での相対的な重み。グループごとに合計 1.0 になるように書く。",
    "layers[].evidenceOnly を true にすると、そのレイヤーは加点があるときだけ母数に入る。ハニーポットは『引っかかれば決定的な証拠、無反応なら何の情報でもない』ため true にしている。",
    "総合スコア = combine で決める。noisy-or では 1 - Π(1 - groupスコア * groupの weight)。『bot らしさ』と『営業らしさ』は独立した疑いなので、どちらか一方だけでもしきい値に到達できるようにするための既定値。weighted-mean にすると groups[].weight による加重平均になる。",
    "hardBlock に挙げた code が1つでも立つと、他のスコアに関係なく block になる。",
    "points に未登録の code は 0 点として扱われ、result.warnings に列挙される(タイポ検知用)。",
    "チューニングの目安: まず thresholds を動かし、次に layers[].weight、最後に個別の points を触る。"
  ],
  "thresholds": {
    "review": 0.4,
    "block": 0.62
  },
  "hardBlock": ["honeypot.filled", "honeypot.decoyChecked"],
  "layers": {
    "honeypot": {
      "label": "Layer 1 ハニーポット",
      "group": "automation",
      "weight": 0.12,
      "evidenceOnly": true,
      "saturation": 4,
      "points": {
        "honeypot.filled": 4,
        "honeypot.decoyChecked": 4,
        "honeypot.fieldMissing": 2,
        "honeypot.tokenMissing": 2,
        "honeypot.tokenTampered": 3
      }
    },
    "behavior": {
      "label": "Layer 2 行動解析",
      "group": "automation",
      "weight": 0.28,
      "saturation": 6,
      "points": {
        "behavior.instantSubmit": 4,
        "behavior.fastSubmit": 2.5,
        "behavior.noMouseActivity": 2,
        "behavior.noFocusEvents": 2,
        "behavior.impossibleTypingSpeed": 3,
        "behavior.noKeystrokes": 2.5,
        "behavior.pastedBody": 1.5,
        "behavior.staleForm": 1
      },
      "tuning": {
        "instantSubmitMs": 1500,
        "fastSubmitMs": 5000,
        "staleFormMs": 7200000,
        "maxPlausibleCharsPerMinute": 1200,
        "minMouseSamples": 3,
        "pastedCharsThreshold": 120
      }
    },
    "environment": {
      "label": "Layer 2.5 自動化ブラウザの痕跡",
      "group": "automation",
      "weight": 0.22,
      "saturation": 6,
      "points": {
        "env.webdriver": 4,
        "env.headlessUserAgent": 4,
        "env.automationUserAgent": 3,
        "env.botUserAgent": 3,
        "env.noPlugins": 1.5,
        "env.chromeObjectMissing": 2,
        "env.noLanguages": 2,
        "env.viewportEqualsScreen": 1.5,
        "env.zeroOuterWindow": 1.5,
        "env.touchInconsistency": 1.5,
        "env.suspiciousHardwareConcurrency": 1,
        "env.permissionsInconsistency": 1.5
      },
      "tuning": {
        "headlessMarkers": ["headlesschrome", "headless"],
        "automationMarkers": ["puppeteer", "playwright", "selenium", "phantomjs", "webdriver"],
        "botUserAgentMarkers": [
          "bot",
          "crawler",
          "spider",
          "python-requests",
          "curl/",
          "wget/",
          "axios/",
          "okhttp",
          "scrapy",
          "http-client"
        ]
      }
    },
    "mimicry": {
      "label": "Layer 2.6 『不自然な自然さ』検知",
      "group": "automation",
      "weight": 0.26,
      "saturation": 5,
      "points": {
        "mimicry.uniformMouseSpeed": 2,
        "mimicry.straightMousePath": 2,
        "mimicry.quantizedMouseSteps": 2,
        "mimicry.uniformKeyIntervals": 2.5,
        "mimicry.quantizedKeyIntervals": 2,
        "mimicry.uniformFieldTransitions": 1.5,
        "mimicry.noJitter": 1.5
      },
      "tuning": {
        "minMouseSamples": 12,
        "minKeyIntervals": 8,
        "minFieldTransitions": 3,
        "mouseSpeedCvFloor": 0.18,
        "keyIntervalCvFloor": 0.22,
        "fieldTransitionCvFloor": 0.12,
        "straightnessCeiling": 0.985,
        "quantizedRatioCeiling": 0.6,
        "jitterFloorPx": 0.75
      }
    },
    "checkbox": {
      "label": "Layer 3 チェックボックス認証",
      "group": "automation",
      "weight": 0.12,
      "saturation": 4,
      "points": {
        "checkbox.unchecked": 3,
        "checkbox.programmaticCheck": 4,
        "checkbox.instantCheck": 2,
        "checkbox.noPointerTrail": 1.5,
        "checkbox.excessiveToggles": 1
      },
      "tuning": {
        "instantCheckMs": 250,
        "minPointerTrail": 1,
        "maxToggles": 6
      }
    },
    "content": {
      "label": "Layer 4 営業文面判定",
      "group": "sales",
      "weight": 0.75,
      "saturation": 6,
      "points": {
        "content.ngWords": 4,
        "content.urlSpam": 2,
        "content.companyIntroOpening": 2,
        "content.signatureBlock": 1.5,
        "content.noJapaneseOnJapaneseForm": 1
      },
      "tuning": {
        "minChars": 24,
        "ngScoreSaturation": 12,
        "freeUrlAllowance": 1,
        "urlSaturation": 4,
        "companyIntroHeadChars": 120
      }
    },
    "aiText": {
      "label": "Layer 6 AI生成文っぽさ判定",
      "group": "sales",
      "weight": 0.25,
      "saturation": 5,
      "points": {
        "ai.uniformSentenceLength": 2,
        "ai.politeTemplateDensity": 2,
        "ai.lowBurstiness": 1.5,
        "ai.structuredListing": 1,
        "ai.noTypos": 1
      },
      "tuning": {
        "minChars": 80,
        "minSentences": 4,
        "sentenceLengthCvFloor": 0.32,
        "politePhraseDensityCeiling": 0.012,
        "burstinessFloor": 0.35,
        "humanNoiseMarkers": [
          "！！",
          "。。",
          "、、",
          "www",
          "笑",
          "すみません",
          "ごめん",
          "ちょっと",
          "とりあえず",
          "よろしくです",
          "！？",
          "?!"
        ],
        "politePhrases": [
          "いただければ",
          "いただけますと",
          "いただけますでしょうか",
          "させていただき",
          "させていただければ",
          "ご検討いただ",
          "幸いです",
          "幸甚",
          "存じます",
          "お忙しいところ",
          "お忙しい中",
          "何卒",
          "よろしくお願い申し上げます",
          "ご確認のほど",
          "恐れ入りますが",
          "誠に",
          "つきましては",
          "なお、",
          "また、",
          "さらに、"
        ]
      }
    }
  },
  "combine": "noisy-or",
  "groups": {
    "automation": {
      "label": "自動化・bot の疑い",
      "weight": 1
    },
    "sales": {
      "label": "営業・勧誘目的の疑い",
      "weight": 1
    }
  }
}
